{
  "version": "1.0",
  "motion_id": "scratch_head",
  "character_id": "example_character",
  "fps": 12,
  "duration_seconds": 3,
  "s0_sha256": "0000000000000000000000000000000000000000000000000000000000000000",
  "poses": [
    {"id": "s0", "frame": 0, "joints": {}},
    {"id": "anticipation", "frame": 4, "joints": {}},
    {"id": "contact", "frame": 16, "joints": {}},
    {"id": "release", "frame": 28, "joints": {}},
    {"id": "s0", "frame": 36, "joints": {}}
  ]
}
